sentimento,empresa,tempo_reclamacao,status,titulo,seguro,sinistro,prestamista,carro,cancelamento,protecao,atendimento,rembolso
Negativo,AIG Seguros Brasil,45,Não resolvido,Demora da analise,false,false,false,false,false,false,false,false
Negativo,AIG Seguros Brasil,5,Resolvido,"Solicito o deposito em minha conta do valor referente ao seguro ""Proteção de Preço Visa""",true,false,false,false,false,true,false,false
Negativo,AIG Seguros Brasil,34,Não resolvido,Proteção de Preços Negada,false,false,false,false,false,true,false,false
Negativo,AIG Seguros Brasil,17,Resolvido,Seguro Proteção de Preço Visa Não pago - Bilhete 03728199,true,false,false,false,false,true,false,false
Negativo,AIG Seguros Brasil,29,Não resolvido,Não pagamento - Proteção de Preços - VISA,false,false,false,false,false,true,false,false
Negativo,AIG Seguros Brasil,21,Não resolvido,atraso na resolução dos sinistros,false,true,false,false,false,false,false,false
Negativo,AIG Seguros Brasil,25,Não resolvido,Proteção de preço visa,false,false,false,false,false,true,false,false
Negativo,AIG Seguros Brasil,11,Resolvido,AIG e VISA não pagam meu sinistro,false,true,false,false,false,false,false,false
Negativo,AIG Seguros Brasil,6,Não resolvido,Proteção de preço atrasada!,false,false,false,false,false,true,false,false
Negativo,AIG Seguros Brasil,45,Resolvido,Pagamento do seguro proteção de preço,true,false,false,false,false,true,false,false
Negativo,AIG Seguros Brasil,35,Não resolvido,Seguro ainda não creditado!,true,false,false,false,false,false,false,false
Negativo,AIG Seguros Brasil,12,Resolvido,Seguro de Proteção de Preços não pago e sem previsão de depósito,true,false,false,false,false,true,false,false
Positivo,AIG Seguros Brasil,25,Resolvido,Demora para resposta de sinistro,false,true,false,false,false,false,false,false
Positivo,AIG Seguros Brasil,39,Resolvido,Atraso Seguro Proteção de Compras Visa,true,false,false,false,false,true,false,false
Positivo,AIG Seguros Brasil,44,Resolvido,Não depositaram Seguro Proteção de Preco,true,false,false,false,false,true,false,false
Positivo,AIG Seguros Brasil,31,Resolvido,Demora para pagamento de Proteção Preço Visa,false,false,false,false,false,true,false,false
Positivo,AIG Seguros Brasil,13,Resolvido,"Proteção de Preços do cartão Visa Infinite foi aprovada, mas não foi paga até agora",false,false,false,false,false,true,false,false
Positivo,AIG Seguros Brasil,5,Resolvido,Seguro não pago,true,false,false,false,false,false,false,false
Positivo,AIG Seguros Brasil,3,Resolvido,PROTEÇÃO DE PREÇO,false,false,false,false,false,false,false,false
Positivo,AIG Seguros Brasil,28,Resolvido,NÃO PAGAMENTO DE SEGUROS AIG/VISA,false,false,false,false,false,false,false,false
Positivo,AIG Seguros Brasil,53,Resolvido,Aguardando pagamento cujo prazo já se encerrou há muito tempo,false,false,false,false,false,false,false,false
Positivo,AIG Seguros Brasil,3,Resolvido,Atraso no pagamento de sinistro,false,true,false,false,false,false,false,false
Positivo,AIG Seguros Brasil,31,Resolvido,Sem retorno na Proteção de Preço,false,false,false,false,false,true,false,false
Positivo,AIG Seguros Brasil,28,Resolvido,Ainda nao recebi o sinistro aprovado Número do bilhete: 03714547,false,true,false,false,false,false,false,false
Positivo,AIG Seguros Brasil,14,Resolvido,Seguro proteção de preços aprovado e não pago,true,false,false,false,false,true,false,false
Positivo,AIG Seguros Brasil,30,Resolvido,Demora na análise de seguro do cartão visa,true,false,false,false,false,false,false,false
Positivo,AIG Seguros Brasil,29,Resolvido,Sinistro proteção de Preço Parado a mais de Mês,false,true,false,false,false,true,false,false
Positivo,AIG Seguros Brasil,4,Resolvido,Seguro proteção de preço não recebido,true,false,false,false,false,true,false,false
Positivo,AIG Seguros Brasil,28,Resolvido,"Deram um prazo do meu sinistro de 15 dias e ate hoje não recebi nada, já reclamei no site da visa e do AIG e não recebi nenhum retorno.",false,true,false,false,false,false,false,false
Positivo,AIG Seguros Brasil,8,Resolvido,Sinistro não pago pela AIG,false,true,false,false,false,false,false,false
Positivo,AIG Seguros Brasil,27,Resolvido,AIG Seguros Brasil não cumpriu com o Pagamento do meu Sinistro,true,true,false,false,false,false,false,false
Positivo,AIG Seguros Brasil,53,Resolvido,ATRASO NO PAGAMENTO DO SEGURO PROTEÇÃO DE PREÇO - VISA,false,false,false,false,false,false,false,false
Positivo,AIG Seguros Brasil,13,Resolvido,"Seguro proteção de preço aprovado, Mais não recebi",true,false,false,false,false,true,false,false
Positivo,AIG Seguros Brasil,24,Resolvido,SEGURO PROTEÇÃO DE PREÇO - BILHETE 03709940,false,false,false,false,false,false,false,false
Positivo,AIG Seguros Brasil,34,Resolvido,Seguro não foi pago,true,false,false,false,false,false,false,false
Positivo,AIG Seguros Brasil,15,Resolvido,Seguro Proteção de Preço,true,false,false,false,false,true,false,false
Positivo,AIG Seguros Brasil,31,Resolvido,Atraso no pagamento do seguro proteção de preço,true,false,false,false,false,true,false,false
Positivo,AIG Seguros Brasil,29,Resolvido,Demora na análise do sisnistro de compra protegida cartão Mastercard,false,false,false,false,false,false,false,false
Negativo,Zurich Brasil Seguros,41,Não resolvido,EMPRESA NÃO SOLUCIONA O PROBLEMA E MOSTRA LAUDO QUE NÃO RETRATA A REALIDADE,false,false,false,false,false,false,false,false
Negativo,Zurich Brasil Seguros,26,Resolvido,Restituição de seguros,true,false,false,false,false,false,false,false
Negativo,Zurich Brasil Seguros,15,Não resolvido,Enrolação no atendimento da Garantia Estendida,false,false,false,false,false,false,true,false
Negativo,Zurich Brasil Seguros,20,Resolvido,ZuricH não atende consulmidor com colchão que apresentou defeito.,false,false,false,false,false,false,false,false
Negativo,Zurich Brasil Seguros,7,Não resolvido,Não consigo atendimento do seguro,true,false,false,false,false,false,true,false
Negativo,Zurich Brasil Seguros,31,Resolvido,Assistência técnica ruim e pós zurich péssimo,false,false,false,false,false,false,false,false
Negativo,Zurich Brasil Seguros,21,Resolvido,Cancelamento do seguro celular,true,false,false,false,true,false,false,false
Negativo,Zurich Brasil Seguros,28,Não resolvido,PÉSSIMO ATENDIMENTO DA EMPRESA,false,false,false,false,false,false,false,false
Negativo,Zurich Brasil Seguros,34,Não resolvido,NEGATIVA DE PAGAMENTO DE PEQUENOS REPAROS,false,false,false,false,false,false,false,false
Negativo,Zurich Brasil Seguros,12,Não resolvido,Não querem cobrir o sinistro de Furto Qualificado,false,true,false,false,false,false,false,false
Negativo,Zurich Brasil Seguros,41,Não resolvido,Uma porcaria,false,false,false,false,false,false,false,false
Negativo,Zurich Brasil Seguros,19,Não resolvido,Não entregou conserto do carro no prazo estipulado pela susep,false,false,false,true,false,false,false,false
Negativo,Zurich Brasil Seguros,8,Resolvido,Aguardando o pagamento,false,false,false,false,false,false,false,false
Negativo,Zurich Brasil Seguros,8,Não resolvido,Seguro sem Responsabilidade com Cliente,true,false,false,false,false,false,false,false
Negativo,Zurich Brasil Seguros,2,Não resolvido,Zurich nega cobertura a sinistro do meu celular,false,true,false,false,false,false,false,false
Negativo,Zurich Brasil Seguros,43,Não resolvido,Reparamos sinistro por inteiro e recebemos parcialmente.,false,true,false,false,false,false,false,false
Negativo,Zurich Brasil Seguros,6,Não resolvido,"QUERO PAGAR MEU SEGURO À VISTA, DE ACORDO COM A PROPOSTA ENVIADA, E ESTÃO ME IMPEDINDO, FORÇANDO O PAGAMENTO PARCELADO COM JUROS.",false,false,false,false,false,false,false,false
Negativo,Zurich Brasil Seguros,21,Não resolvido,Falha na prestação de Serviços,false,false,false,false,false,false,false,false
Negativo,Zurich Brasil Seguros,86,Não resolvido,NAO COBRIRAM MEU SEGURO SENDO QUE ESTA NO CONTRATO,false,false,false,false,false,false,false,false
Negativo,Zurich Brasil Seguros,7,Não resolvido,Falta de atendimento,false,false,false,false,false,false,true,false
Negativo,Zurich Brasil Seguros,8,Não resolvido,Não quiz fazer a troca da televisão por uma da mesma,false,false,false,false,false,false,false,false
Negativo,Zurich Brasil Seguros,10,Não resolvido,Demora em dar retorno e passar informações sobre sinistro,false,true,false,false,false,false,false,false
Negativo,Zurich Brasil Seguros,7,Resolvido,DEMORA PARA PAGAR,false,false,false,false,false,false,false,false
Negativo,Zurich Brasil Seguros,2,Não resolvido,DESCASO COM O CLIENTE - Geladeira Não funciona,false,false,false,false,false,false,false,false
Negativo,Zurich Brasil Seguros,11,Não resolvido,Espera excessiva para um reboque,false,false,false,false,false,false,false,false
Negativo,Zurich Brasil Seguros,7,Não resolvido,Sinistro negado indevidamente,false,true,false,false,false,false,false,false
Negativo,Zurich Brasil Seguros,47,Resolvido,CELULAR GARANTIA ESTENDIDA. NÃO REPARARAM A CONTENTO,false,false,false,false,false,false,false,false
Negativo,Zurich Brasil Seguros,19,Não resolvido,Cancelamento Indevido de apólice após erro em pagar boleto,false,false,false,false,true,false,false,false
Negativo,Zurich Brasil Seguros,11,Não resolvido,Prejuízo causado pela zurich a cliente,false,false,false,false,false,false,false,false
Negativo,Zurich Brasil Seguros,9,Não resolvido,Notebook veio do concerto com defeito e não querem me reembolsar,false,false,false,false,false,false,false,false
Negativo,Zurich Brasil Seguros,9,Não resolvido,PESSIMA SEGURADORA,false,false,false,false,false,false,false,false
Negativo,Zurich Brasil Seguros,15,Não resolvido,CANCELAMENTO E ESTORNO SEGURO AUTO,false,false,false,false,false,false,false,false
Negativo,Zurich Brasil Seguros,11,Não resolvido,Sem geladeira Zurich dificulta pagamento de seguro,true,false,false,false,false,false,false,false
Negativo,Zurich Brasil Seguros,13,Não resolvido,Demora pra. Liberar seguro,true,false,false,false,false,false,false,false
Negativo,Zurich Brasil Seguros,7,Não resolvido,Seguradora engana cliente,false,false,false,false,false,false,false,false
Negativo,Zurich Brasil Seguros,46,Resolvido,Reembolso de Lucros Cessantes,false,false,false,false,false,false,false,true
Negativo,Zurich Brasil Seguros,42,Não resolvido,Não consertaram só trocaram o HD 500 por outro,false,false,false,false,false,false,false,false
Negativo,Zurich Brasil Seguros,7,Não resolvido,DESCASO COM O SEGURADO NO PAGAMENTO DA INDENIZAÇÃO!,false,false,false,false,false,false,false,false
Negativo,Zurich Brasil Seguros,10,Não resolvido,Seguro que não foi indenizado,true,false,false,false,false,false,false,false
Negativo,Zurich Brasil Seguros,16,Não resolvido,ZURICH NÃO DA SUPORTE PARA O SEGURO CONTRATADO,false,false,false,false,false,false,false,false
Negativo,Zurich Brasil Seguros,13,Não resolvido,Cobertura contratada diferente da cobertura atendida,false,false,false,false,false,false,false,false
Negativo,Zurich Brasil Seguros,9,Não resolvido,Encanador nunca chega,false,false,false,false,false,false,false,false
Negativo,Zurich Brasil Seguros,37,Resolvido,Falta de Assistência e Reembolso,false,false,false,false,false,false,false,true
Negativo,Zurich Brasil Seguros,25,Não resolvido,Pagamento de Sinistro negado indevidamente,false,true,false,false,false,false,false,false
Negativo,Zurich Brasil Seguros,10,Não resolvido,Contato impossível.,false,false,false,false,false,false,false,false
Negativo,Zurich Brasil Seguros,19,Não resolvido,Falta de compromisso,false,false,false,false,false,false,false,false
Negativo,Zurich Brasil Seguros,17,Não resolvido,DEMORA E DESCASO COM O CLIENTE APOS UM SINISTRO,false,false,false,false,false,false,false,false
Negativo,Zurich Brasil Seguros,28,Não resolvido,GARANTIA EXTENDIDA SMART TV LG 50 POLEGADAS - RECUSA DO REPARO,false,false,false,false,false,false,false,false
Negativo,Zurich Brasil Seguros,6,Não resolvido,Retorno da empresa,false,false,false,false,false,false,false,false
Negativo,Zurich Brasil Seguros,9,Não resolvido,Zurich brasil seguros .,true,false,false,false,false,false,false,false
Negativo,Zurich Brasil Seguros,35,Não resolvido,Atraso no crédito de reembolso de despesas,false,false,false,false,false,false,false,true
Negativo,Zurich Brasil Seguros,49,Não resolvido,Carta de anuência,false,false,false,false,false,false,false,false
Negativo,Zurich Brasil Seguros,70,Não resolvido,Não consigo acionar a garantia estendida,false,false,false,false,false,false,false,false
Negativo,Zurich Brasil Seguros,15,Não resolvido,Falta de assistenica,false,false,false,false,false,false,false,false
Negativo,Zurich Brasil Seguros,9,Resolvido,Acionamento de seguros,true,false,false,false,false,false,false,false
Negativo,Zurich Brasil Seguros,7,Não resolvido,Falta de atendimento,false,false,false,false,false,false,true,false
Negativo,Zurich Brasil Seguros,23,Não resolvido,Não cumprem código defesa do consumidor,false,false,false,false,false,false,false,false
Negativo,Zurich Brasil Seguros,19,Não resolvido,Prazo inaceitável para encerrar um Sinistro,false,true,false,false,false,false,false,false
Negativo,Zurich Brasil Seguros,38,Resolvido,Recebimento de sinistro,false,true,false,false,false,false,false,false
Negativo,Zurich Brasil Seguros,9,Não resolvido,Falta de atendimento de seguro estendido,true,false,false,false,false,false,true,false
Negativo,Zurich Brasil Seguros,19,Não resolvido,"Péssima seguradora, as duas vezes que precisei foi horrível",false,false,false,false,false,false,false,false
Negativo,Zurich Brasil Seguros,47,Resolvido,Não consigo contato com a Ouvidoria,false,false,false,false,false,false,false,false
Negativo,Zurich Brasil Seguros,9,Resolvido,Redução Bonus indevida do 9 para 4,false,false,false,false,false,false,false,false
Negativo,Zurich Brasil Seguros,10,Não resolvido,2 vezes com o mesmo problema em menos de 1 mes apos primeiro concerto,false,false,false,false,false,false,false,false
Negativo,Zurich Brasil Seguros,18,Resolvido,Descaso com o prazo,false,false,false,false,false,false,false,false
Negativo,Zurich Brasil Seguros,12,Resolvido,Garantia não prestada,false,false,false,false,false,false,false,false
Negativo,Zurich Brasil Seguros,28,Resolvido,"Acionei assistencia 24hs para um serviço e preciso do comprovante, que a Zurick nao me envia e fica jogando para o prestador de serviço que tb nao resolve.",false,false,false,false,false,false,false,false
Negativo,Zurich Brasil Seguros,4,Resolvido,Seguro Auto Zurich Seguros,true,false,false,false,false,false,false,false
Negativo,Zurich Brasil Seguros,35,Resolvido,[Editado pelo Reclame Aqui]/furto,false,false,false,false,false,false,false,false
Negativo,Zurich Brasil Seguros,3,Não resolvido,Seguro conta paga 02,true,false,false,false,false,false,false,false
Negativo,Zurich Brasil Seguros,26,Resolvido,Pior Seguradora de todos os tempos!,false,false,false,false,false,false,false,false
Negativo,Zurich Brasil Seguros,11,Resolvido,SEGURO ENGANOSO,false,false,false,false,false,false,false,false
Negativo,Zurich Brasil Seguros,10,Não resolvido,Sinistro não resolvido 2131151,false,true,false,false,false,false,false,false
Negativo,Zurich Brasil Seguros,16,Não resolvido,Enganado pela Zuric seguros,true,false,false,false,false,false,false,false
Negativo,Zurich Brasil Seguros,8,Não resolvido,PARECER ANÁLISE DE SEGURO,false,false,false,false,false,false,false,false
Positivo,Zurich Brasil Seguros,36,Resolvido,Incluiram um seguro no financiamento sem eu pedir!!,true,false,false,false,false,false,false,false
Positivo,Zurich Brasil Seguros,8,Resolvido,Meu aspirador assegurado não foi ressarcido,false,false,false,false,false,false,false,false
Positivo,Zurich Brasil Seguros,14,Resolvido,NÃO DEIXAM EU CANCELAR O SEGURO!!!,false,false,false,false,false,false,false,false
Positivo,Zurich Brasil Seguros,9,Resolvido,Reembolso não entregue,false,false,false,false,false,false,false,true
Positivo,Zurich Brasil Seguros,1,Resolvido,Reembolso,false,false,false,false,false,false,false,true
Positivo,Zurich Brasil Seguros,14,Resolvido,Problemas em emissão de apólice,false,false,false,false,false,false,false,false
Positivo,Zurich Brasil Seguros,5,Resolvido,Até hoje a documentação está pendente?,false,false,false,false,false,false,false,false
Positivo,Zurich Brasil Seguros,7,Resolvido,GARANTIA ESTENDIDA,false,false,false,false,false,false,false,false
Positivo,Zurich Brasil Seguros,6,Resolvido,Não localizo minha garantia estendida,false,false,false,false,false,false,false,false
Positivo,Zurich Brasil Seguros,5,Resolvido,Péssimo atendimento assistência 24 horas,false,false,false,false,false,false,true,false
Positivo,Zurich Brasil Seguros,25,Resolvido,Desistência ou cancelamento de seguro,true,false,false,false,true,false,false,false
Positivo,Zurich Brasil Seguros,36,Resolvido,DESCASO ELETROLUX - EFETUAR TROCA DO PRODUTO URGENTE,false,false,false,false,false,false,false,false
Positivo,Zurich Brasil Seguros,31,Resolvido,Há 2 meses esperando pagamento de indenização de perda total de veículo,false,false,false,false,false,false,false,false
Positivo,Zurich Brasil Seguros,9,Resolvido,SEM SOLUÇÃO!.SEM CARRO!,false,false,false,false,false,false,false,false
Positivo,Zurich Brasil Seguros,11,Resolvido,Desrespeito ao consumidor,false,false,false,false,false,false,false,false
Positivo,Zurich Brasil Seguros,8,Resolvido,Problema Intermitente no Equipamento com Garantia Extendia,false,false,false,false,false,false,false,false
Positivo,Zurich Brasil Seguros,8,Resolvido,Seguro conta paga,true,false,false,false,false,false,false,false
Positivo,Zurich Brasil Seguros,10,Resolvido,Continuo com problemas no trato com a Zurich sobre sinistro e franquia,false,true,false,false,false,false,false,false
Positivo,Zurich Brasil Seguros,30,Resolvido,Atraso no reparo,false,false,false,false,false,false,false,false
Positivo,Zurich Brasil Seguros,7,Resolvido,Zurich Minas Brasil e o [Editado pelo Reclame Aqui] da garantia extendida.,false,false,false,false,false,false,false,false
Positivo,Zurich Brasil Seguros,16,Resolvido,Seguro bolsa protegida sem resposta,true,false,false,false,false,false,false,false
Positivo,Zurich Brasil Seguros,7,Resolvido,Apólice Cancelada sem consentimento,false,false,false,false,false,false,false,false
Positivo,Zurich Brasil Seguros,3,Resolvido,Garantia estendida,false,false,false,false,false,false,false,false
Positivo,Zurich Brasil Seguros,6,Resolvido,Venda de garantia extendida da Zurich,false,false,false,false,false,false,false,false
Positivo,Zurich Brasil Seguros,20,Resolvido,Sem solução para o sinistro do seguro da geladeira Electrolux comprada nas casas Bahia,true,true,false,false,false,false,false,false
Positivo,Zurich Brasil Seguros,38,Resolvido,Descaso e desrespeito,false,false,false,false,false,false,false,false
Positivo,Zurich Brasil Seguros,19,Resolvido,Falta de compromisso da assistência técnica da empresa Zurich seguros,true,false,false,false,false,false,false,false
Positivo,Zurich Brasil Seguros,5,Resolvido,Seguradora,false,false,false,false,false,false,false,false
Negativo,Tokio Marine Seguradora,4,Não resolvido,Não cobriu colisão,false,false,false,false,false,false,false,false
Negativo,Tokio Marine Seguradora,3,Não resolvido,negativa de cobertura indevida,false,false,false,false,false,false,false,false
Negativo,Tokio Marine Seguradora,17,Não resolvido,Decepcionado muito !!!,false,false,false,false,false,false,false,false
Negativo,Tokio Marine Seguradora,1,Não resolvido,Tokio marine recusou pagamento,false,false,false,false,false,false,false,false
Negativo,Tokio Marine Seguradora,18,Não resolvido,Péssimo atendimento e falta de guincho!,false,false,false,false,false,false,true,false
Negativo,Tokio Marine Seguradora,13,Não resolvido,Não contrate Tokio Marine - Não tem Prestador - Guincho demora mais de 3 horas,false,false,false,false,false,false,false,false
Negativo,Tokio Marine Seguradora,73,Não resolvido,TOKIO MARINE falida!,false,false,false,false,false,false,false,false
Negativo,Tokio Marine Seguradora,48,Não resolvido,Seguro cancelado por falha na vistoria,true,false,false,false,false,false,false,false
Negativo,Tokio Marine Seguradora,12,Não resolvido,"Atraso da seguradora para vistoria, para entrega de peças, pra tudo",false,false,false,false,false,false,false,false
Negativo,Tokio Marine Seguradora,23,Não resolvido,[Editado pelo Reclame Aqui] DA SEGURADORA,false,false,false,false,false,false,false,false
Negativo,Tokio Marine Seguradora,13,Não resolvido,Seguro não compareceu ao local para prestar socorro ao veículo,true,false,false,false,false,false,false,false
Negativo,Tokio Marine Seguradora,15,Resolvido,SEM ATENDIMENTO,false,false,false,false,false,false,false,false
Negativo,Tokio Marine Seguradora,9,Não resolvido,Seguro de farois e lanternas,true,false,false,false,false,false,false,false
Negativo,Tokio Marine Seguradora,24,Não resolvido,Reembolso,false,false,false,false,false,false,false,true
Negativo,Tokio Marine Seguradora,9,Resolvido,Conserto que NUNCA é aprovado,false,false,false,false,false,false,false,false
Negativo,Tokio Marine Seguradora,18,Resolvido,A empresa é boa até que vc acione o serviço.,false,false,false,false,false,false,false,false
Negativo,Tokio Marine Seguradora,9,Não resolvido,Não debitaram a parcela do seguro no meu cartão,true,false,false,false,false,false,false,false
Negativo,Tokio Marine Seguradora,5,Resolvido,Reclamação Processo Sinistro 3495620,false,true,false,false,false,false,false,false
Negativo,Tokio Marine Seguradora,27,Resolvido,Demora na aprovação de complemento de processo de sinistro,false,true,false,false,false,false,false,false
Negativo,Tokio Marine Seguradora,12,Não resolvido,Não recomendo a TOKIO MARINE: Assistência Auto péssima,false,false,false,false,false,false,false,false
Negativo,Tokio Marine Seguradora,10,Não resolvido,Sem cobertura_teto panorâmico_Peugeot 308,false,false,false,false,false,false,false,false
Negativo,Tokio Marine Seguradora,7,Não resolvido,Divergência de informações influência no andamento do sinistro gerando danos,false,true,false,false,false,false,false,false
Negativo,Tokio Marine Seguradora,1,Não resolvido,Burocracia no sinistro de veículo,false,true,false,false,false,false,false,false
Negativo,Tokio Marine Seguradora,39,Não resolvido,Forçaram o reparo no veiculo e demora por falta de peças,false,false,false,false,false,false,false,false
Negativo,Tokio Marine Seguradora,5,Não resolvido,Ineficiência de todos os serviços,false,false,false,false,false,false,false,false
Negativo,Tokio Marine Seguradora,9,Não resolvido,"Acidente causado por assegurado, demora para reparo!",false,false,false,false,false,false,false,false
Negativo,Tokio Marine Seguradora,19,Não resolvido,Não querem trocar para-choque avariado,false,false,false,false,false,false,false,false
Negativo,Tokio Marine Seguradora,30,Não resolvido,Sinistro com mais de 40 dias sem resolução,false,true,false,false,false,false,false,false
Negativo,Tokio Marine Seguradora,16,Não resolvido,Assistencia 24 ineficiente.,false,false,false,false,false,false,false,false
Negativo,Tokio Marine Seguradora,35,Resolvido,Perito Nunca Comparece À Concessionária Para Avaliação Do Sinistro,false,true,false,false,false,false,false,false
Negativo,Tokio Marine Seguradora,15,Não resolvido,Mais de 30 minutos após ligar na assistência 24 hrs nem sequer começaram a procurar prestadores,false,false,false,false,false,false,false,false
Negativo,Tokio Marine Seguradora,11,Não resolvido,Quando precisei não fui atendido,false,false,false,false,false,false,false,false
Negativo,Tokio Marine Seguradora,23,Não resolvido,Exigência de rastreador,false,false,false,false,false,false,false,false
Negativo,Tokio Marine Seguradora,2,Não resolvido,Ocorreu o sinistro e não pagaram o seguro!!!,true,true,false,false,false,false,false,false
Negativo,Tokio Marine Seguradora,8,Resolvido,"Não atendem na hora de emergência, autoriza pedir particular e não reembolsam",false,false,false,false,false,false,false,false
Negativo,Tokio Marine Seguradora,15,Não resolvido,Sinistro Recusado após Semanas do Carro Parado na Oficina,false,true,false,true,false,false,false,false
Negativo,Tokio Marine Seguradora,17,Não resolvido,NEGARAM A SUBSTITUIÇÃO DO RETROVISOR MESMO TEMDO COBERTURA COMPLETA,false,false,false,false,false,false,false,false
Negativo,Tokio Marine Seguradora,11,Não resolvido,Lucros cessantes,false,false,false,false,false,false,false,false
Negativo,Tokio Marine Seguradora,9,Não resolvido,Vão me reembolsar sobre um valor errado e muito depois do prazo.,false,false,false,false,false,false,false,false
Negativo,Tokio Marine Seguradora,8,Resolvido,SEGURADORA SE RECUSA PAGAR LUCRO CESSANTE,false,false,false,false,false,false,false,false
Negativo,Tokio Marine Seguradora,14,Não resolvido,Cobrança indevida do sinistro do meu carro,false,true,false,true,false,false,false,false
Negativo,Tokio Marine Seguradora,41,Resolvido,Seguradora emite demonstrativo dizendo que pagou o valor do sinistro e não recebi 1 real,false,true,false,false,false,false,false,false
Negativo,Tokio Marine Seguradora,2,Não resolvido,Empresa não resolve o problema,false,false,false,false,false,false,false,false
Negativo,Tokio Marine Seguradora,58,Resolvido,Seguradora não responde aviso de sinistro,false,true,false,false,false,false,false,false
Negativo,Tokio Marine Seguradora,10,Não resolvido,Endosso na tokio marine não é levado a sério pela própria CIA,false,false,false,false,false,false,false,false
Negativo,Tokio Marine Seguradora,17,Não resolvido,Um lixo de seguradora.,false,false,false,false,false,false,false,false
Negativo,Tokio Marine Seguradora,13,Não resolvido,Bom dia! Foi agendado dois reboques para meu veículo e não me atenderam.,false,false,false,false,false,false,false,false
